id,category,source,url,reference_summary,who,done
b051,business,abcnews.com,https://abcnews.com/Business/general-motors-expects-500-million-tariff-refund-after/story?id=132447958,"General Motors disclosed on its Q1 2026 earnings call that it expects to receive approximately $500 million in tariff refunds following the Supreme Court's ruling striking down Trump's broad reciprocal IEEPA tariffs. The Trump administration opened an online portal for importers to apply for the $166 billion in total refunds owed, plus interest. For GM, the refund partially offsets rising costs linked to the Iran war — including higher commodity prices, logistics expenses, and a diversion of 7,500 SUVs from Middle East markets. The company raised its 2026 earnings guidance modestly but said the war prevents a more aggressive upgrade. CEO Mary Barra noted that consumer demand for high-priced trucks and SUVs has remained resilient despite elevated gas prices, with an average transaction price of $52,000.",KE,Yes
b052,business,abcnews.com,https://abcnews.com/Business/shoppers-receive-savings-tariff-refunds-experts-explain/story?id=132342919,"Following the Supreme Court's invalidation of Trump's sweeping IEEPA tariffs, the Trump administration opened a portal through which importers — who actually paid the tariffs — can apply for $166 billion in refunds. This article examines whether consumers who bore a share of these costs through higher prices will see any direct benefit. The answer, analysts told ABC News, is: probably not much. Because refunds go to importers rather than end consumers, and companies rarely pass savings through to shoppers in the same way they pass costs through, the average American household that paid an estimated $1,000–$1,680 in higher prices due to tariffs is unlikely to be directly reimbursed. Some companies may absorb refunds into margins or offer modest price reductions, but there is no mechanism for systematic consumer repayment. The article also notes that consumers have no basis to file direct claims with the government.",KE,Yes
b053,business,abcnews.com,https://abcnews.com/Business/standoff-strait-hormuz-trigger-global-recession-economists-weigh/story?id=132270330,"This ABC News analysis surveys leading economists on whether the ongoing closure of the Strait of Hormuz — through which about one-fifth of global oil supply normally flows — could push the world into recession. Economists were divided. The IMF and OECD maintained relatively optimistic baseline forecasts of 3.1% and 2.9% GDP growth for 2026, respectively, but both acknowledged their projections assumed a resolution by mid-year. Oxford Economics' chief global economist Ryan Sweet said a protracted closure of three or more months could trigger a global recession; Oxford separately warned that a six-month impasse could push global oil prices to $190 a barrel and global inflation to 7.7%. Paul Krugman called the IMF ""seriously underestimating"" the risk. Other economists argued that energy-sector resilience and continued consumer spending make a full recession less likely unless the crisis extends well into 2027.",KE,Yes
b054,business,abcnews.com,https://abcnews.com/Business/warner-bros-discovery-shareholders-approve-paramount-takeover/story?id=132314823,"An ABC News piece examining the power struggle surrounding Trump's push to install Kevin Warsh as the next Fed chair. The article traces how Trump's public demands for rate cuts — including a social media post saying anyone who disagrees with him ""will never be the Fed chairman"" — collided with Fed Chair Powell's insistence on institutional independence. Sen. Thom Tillis temporarily threatened to block the Warsh nomination unless the DOJ dropped its probe into Powell. The article also examines how the Iran war has complicated the rate-cut calculus: with energy prices driving inflation above the Fed's 2% target, even Warsh-aligned officials have been reluctant to signal imminent easing. The piece contextualizes the political tension as part of a broader Trump effort to reshape institutions, including the Fed.",KE,Yes
b055,business,abcnews.com,https://abcnews.com/Business/standoff-trumps-fed-chair-nominee-interest-rates/story?id=132200231,"Kevin Warsh faced sharp questioning at his Senate Banking Committee confirmation hearing, where he sought to reassure skeptics that he would maintain Fed independence even as Trump demands lower interest rates. Warsh said Trump never asked him to commit to rate cuts and that he views monetary policy independence as ""essential."" He called for a ""regime change"" in how the Fed measures and communicates inflation, criticized the use of forward guidance and the dot plot as a policy tool, and pledged to reform the Fed's 12 regional reserve banks. On his political positioning, Sen. Elizabeth Warren called him a ""sock puppet,"" but some moderate Democrats offered cautious praise. Warsh also faced questions about his personal wealth and potential conflicts of interest. Sen. Tillis said he supported Warsh in principle but would not vote to advance the nomination until the DOJ probe into Powell was resolved.",KE,Yes
b056,business,abcnews.com,https://abcnews.com/Business/trumps-federal-reserve-chair-nominee-kevin-warsh-testify/story?id=132215744,"On a day when the U.S.-Iran ceasefire was set to expire the following day, stocks closed marginally lower and oil prices jumped as market anxiety mounted over prospects for a second round of peace talks. The Dow fell 4 points, the S&P 500 dipped 0.2%, and the Nasdaq fell 0.2%. Iran's foreign ministry said Tehran had not yet decided on further negotiations, even as U.S. Marines seized an Iranian-flagged vessel in the Gulf of Oman. WTI crude climbed more than 5%, to around $88 a barrel. The article situates the market action within the broader tension: the ""most severe oil supply shock in history"" (per the IEA) caused by Iran's Strait of Hormuz closure, with Americans already paying above $4 per gallon for gasoline and economists increasingly warning of recession risk if the conflict extends.",KE,Yes
b057,business,abcnews.com,https://abcnews.com/Business/stocks-tumble-oil-prices-rise-us-iran-ceasefire/story?id=132200222,"Markets surged on April 18 after Iranian Foreign Minister Abbas Araghchi declared on social media that the Strait of Hormuz would be ""completely open"" for commercial shipping during the ceasefire period following Israel and Lebanon agreeing to their own 10-day ceasefire. Trump confirmed the strait's reopening on Truth Social. The Dow jumped 869 points (+1.7%), the S&P 500 gained 1.2%, and the Nasdaq rose 1.5%. WTI crude plunged more than 10% to around $84 a barrel — its lowest since mid-March. The rally fully recouped the Dow's losses since the war began. Still, analysts cautioned that U.S. oil prices remained more than 30% above pre-war levels, the naval blockade remained in place, and infrastructure damage meant a full recovery in energy markets would take time.",KE,Yes
b058,business,abcnews.com,https://abcnews.com/Business/stocks-surge-oil-prices-plunge-after-iran-strait/story?id=132135940,"A feature interview with Casey Currie, the 2020 Dakar Rally champion and professional off-road racer, conducted ahead of his participation in the Norra 1000 rally in Mexico. Currie discusses driving the Jeep Wrangler Striker concept — a 700-horsepower custom build with 30 inches of rear wheel travel and independent front suspension — designed to hit over 100 mph and handle 200-to-300-foot whoops. He talks about his career trajectory from mechanic to Dakar winner, the differences between rally racing events, near-accidents in competition, and advice for aspiring off-road drivers. Currie also shares his personal goals, including a road trip across the U.S. with his family and plans to race at Crandon and the Norra 500. The piece is part of ABC's occasional series on niche sports and competitive pursuits.",KE,Yes
b059,business,abcnews.com,https://abcnews.com/Business/beast-off-road-racer-casey-currie-built-700/story?id=132060952,An early ABC News analysis of how the U.S. naval blockade of Iranian ports — imposed after ceasefire talks in Islamabad failed — is amplifying the global oil and gasoline price crisis. The blockade prevents Iranian crude from reaching the market while simultaneously exacerbating the global supply shortfall already caused by Iran's effective closure of the Strait of Hormuz. The article details the economic mechanics: the IEA called the combined disruption the worst oil supply shock in history; Brent crude was trading near $100 at the time of publication; U.S. average gasoline prices had climbed sharply; and a range of industries relying on petroleum-derived products were facing cascading cost increases. The piece surveys economists who were debating whether the blockade would ultimately succeed in pressuring Iran toward a deal faster than it would harm global economic stability.,KE,Yes
b060,business,abcnews.com,https://abcnews.com/Business/us-blockade-iran-shipping-gas-prices/story?id=131988004,"Warner Bros. Discovery shareholders voted overwhelmingly at a special meeting on April 23 to approve the company's $111 billion acquisition by Paramount Skydance Corporation — a pivotal milestone in what would be one of the largest media mergers in history. The deal, valued at $31 per WBD share, would bring HBO, CNN, Warner Bros., and other WBD properties under the Paramount umbrella led by CEO David Ellison. Shareholders notably rejected, in a non-binding advisory vote, the executive compensation packages tied to the merger. Paramount now needs to secure remaining regulatory approvals — primarily in Europe — before the transaction can close, which company executives expect by Q3 2026. The merger represents a major consolidation of legacy Hollywood studios in response to competition from Netflix and tech giants like Amazon and Apple.",KE,Yes