id,category,source,url,reference_summary,who,done
b001,politics,www.cnn.com,https://www.cnn.com/2026/04/30/politics/dhs-shutdown-funding-bill-house-vote,"Congress ended the record 75-day shutdown of the Department of Homeland Security on April 30, 2026, after Speaker Mike Johnson conceded in a months-long standoff and passed a Senate-backed funding bill by voice vote. The legislation restored funding for agencies including TSA and FEMA but excluded money for ICE and CBP — a major win for Democrats. Johnson had resisted the bill for weeks as conservative hardliners insisted immigration enforcement funding be included, but pressure from centrist Republicans and a looming recess forced his hand. Republicans plan to fund ICE and CBP separately through budget reconciliation. President Trump signed the bill shortly after passage.",KE,Yes
b002,politics,www.cnn.com,https://www.cnn.com/2026/04/30/politics/congress-gop-dysfunction-johnson,"A CNN analysis published April 30, 2026, describes how Speaker Mike Johnson has effectively lost a functional House majority amid endemic GOP infighting. In a single chaotic week, House leaders held multiple floor votes open for hours, pulled and reinstated the farm bill, narrowly passed a FISA reauthorization with a controversial digital currency rider, and finally capitulated on DHS funding. Johnson faces resistance from hardliners willing to block Trump's own priorities alongside a growing bloc of centrists who are publicly airing frustrations. With poor polling on the Iran war and spiking gas prices, Republicans face worsening conditions ahead of the 2026 midterms. Rep. Kevin Kiley called the 75-day DHS shutdown ""a stunning testament to congressional dysfunction.""

",KE,Yes
b003,politics,www.cnn.com,https://www.cnn.com/2026/04/30/politics/janet-mills-maine-senate,"Maine Governor Janet Mills suspended her Senate campaign on April 30, 2026, citing insufficient financial resources, effectively ceding the Democratic primary to progressive challenger Graham Platner. Mills, a two-term governor recruited by Senate Minority Leader Chuck Schumer, struggled to match Platner in fundraising — he raised $4.1 million to her $2.7 million in the most recent quarter — and trailed badly in polling, losing 64% to 26% in a February University of New Hampshire survey. Platner, a 41-year-old oyster farmer and military veteran endorsed by Sen. Bernie Sanders, now faces Republican Sen. Susan Collins in the general election. Collins is the only Republican senator representing a state Trump lost in 2024, making the race a top Democratic target. Mills did not immediately endorse Platner.",KE,Yes
b004,politics,www.cnn.com,https://www.cnn.com/2026/04/29/politics/james-comey-indictment-trump,"CNN's April 29, 2026, analysis examines the legal fragility of the second federal indictment of former FBI Director James Comey, charged with threatening President Trump by posting a beach photo of seashells arranged to spell ""86 47."" The piece argues the case faces steep hurdles: the phrase ""86"" has multiple slang meanings, dozens of other political figures including pro-Trump influencer Jack Posobiec have used the same expression without prosecution, and under Supreme Court precedent the government must prove Comey knew the post would be perceived as a threat. Critics call it selective prosecution. Acting Attorney General Todd Blanche held a press conference but offered no direct evidence of intent. The analysis notes the irony that an administration that has normalized inflammatory political rhetoric is now prosecuting someone for ambiguous imagery.",KE,Yes
b005,politics,www.cnn.com,https://www.cnn.com/2026/04/28/politics/trump-desantis-redistricting-gerrymander-florida-analysis,"CNN's April 28, 2026, analysis covers Florida Gov. Ron DeSantis's proposal for a mid-decade congressional redistricting that would reduce Democratic representation from eight to four seats, creating a 24-4 Republican-leaning map. The article frames this as the final major move in a national gerrymandering arms race set off by Trump. Democrats, led by House Minority Leader Hakeem Jeffries, vow legal challenges and call it a ""dummymander"" that could backfire given strong recent Democratic performances in Florida special elections. The analysis notes the broader contest: Republican states have redistricted toward roughly 13 GOP seat advantages while Democratic states have countered with approximately 10 Democratic gains. DeSantis's move could tip the balance back to Republicans before the November midterms.",KE,Yes
b006,politics,www.cnn.com,https://www.cnn.com/2026/04/25/politics/war-powers-act-trump-iran-war-congress-analysis,"CNN's April 25, 2026, analysis explains how the 1973 War Powers Resolution puts a 60-day deadline on the Iran war, which Trump launched without congressional authorization on February 28. The administration argues the ceasefire that began April 7 has ""paused"" or ""terminated"" the clock, allowing continued military pressure through a naval blockade without seeking congressional approval. Defense Secretary Pete Hegseth told senators the ceasefire stops the countdown. Sen. Susan Collins disagrees, insisting the 60-day constitutional obligation remains. The piece notes that no president has ever been successfully constrained by the War Powers Resolution, and courts have consistently avoided ruling on it. However, multiple Republican senators have signaled the deadline could mark a turning point for their support.",KE,Yes
b007,politics,www.cnn.com,https://www.cnn.com/2026/04/30/politics/supreme-court-decision-gerrymandering-scramble,"CNN reports that the Supreme Court's 6-3 ruling in Callais v. Louisiana on April 29, 2026, gutted Section 2 of the Voting Rights Act, requiring proof of intentional discrimination rather than just discriminatory effect. The decision immediately triggered a redistricting scramble across multiple states. Louisiana was ordered to redraw its congressional map, pausing its May 16 primaries. Tennessee Republicans face pressure to call a special session to eliminate the state's only Democratic congressman, Rep. Steve Cohen. Georgia, South Carolina, and Alabama are also eyeing changes. Justice Samuel Alito's majority opinion allows states to invoke partisan gerrymandering as a defense in VRA challenges. Voting rights groups warn the ruling has left the law ""a hollow shell.""",KE,Yes
b008,politics,www.cnn.com,https://www.cnn.com/2026/04/30/politics/new-video-moments-before-shooting-press-dinner,"Prosecutors filed new evidence on April 30, 2026, including surveillance footage showing suspect Cole Tomas Allen, 31, casing the Washington Hilton Hotel the day before the shooting at the White House Correspondents' Dinner. The video shows Allen wandering hotel hallways, then rushing through a security checkpoint with a shotgun as an officer's dog patrolled nearby. DC US Attorney Jeanine Pirro confirmed the footage shows Allen firing at a Secret Service officer — directly contradicting friendly-fire speculation. Allen faces charges including attempted assassination of the president and has been ordered held without bail pending trial. Prosecutors say Allen wrote a ""manifesto"" targeting Trump administration officials and traveled from Los Angeles by train to carry out the attack.",KE,Yes
b009,politics,www.cnn.com,https://www.cnn.com/2026/05/01/politics/iran-war-60-day-deadline-congress,"Prosecutors filed new evidence on April 30, 2026, including surveillance footage showing suspect Cole Tomas Allen, 31, casing the Washington Hilton Hotel the day before the shooting at the White House Correspondents' Dinner. The video shows Allen wandering hotel hallways, then rushing through a security checkpoint with a shotgun as an officer's dog patrolled nearby. DC US Attorney Jeanine Pirro confirmed the footage shows Allen firing at a Secret Service officer — directly contradicting friendly-fire speculation. Allen faces charges including attempted assassination of the president and has been ordered held without bail pending trial. Prosecutors say Allen wrote a ""manifesto"" targeting Trump administration officials and traveled from Los Angeles by train to carry out the attack.",KE,Yes
b010,politics,abcnews.com,https://abcnews.com/US/nebraska-1st-state-implement-medicaid-work-requirements/story?id=132529215,"Nebraska became the first state to enforce Medicaid work requirements on May 1, 2026, launching the policy eight months ahead of the January 2027 federal deadline set by the One Big Beautiful Bill Act. The requirements apply to approximately 70,000 Medicaid expansion enrollees ages 19–64, who must demonstrate at least 80 hours of work, community service, or school enrollment per month, or earn at least $580 monthly. The Urban Institute estimates around 25,000 Nebraskans could lose coverage under the policy. Health advocates and legal experts criticized the rollout as rushed, citing a compressed notification timeline, an unresolved federal definition of ""medically frail"" as an exemption category, and inadequate state staffing. Gov. Jim Pillen defended the early launch as promoting self-sufficiency, noting the state's 3.1% unemployment rate. Three additional states — Iowa, Montana, and a third — plan to implement requirements before year-end.",KE,Yes
b011,politics,abcnews.com,https://abcnews.com/Politics/states-redraw-congressional-maps-2026-2028-after-supreme/story?id=132571431,"ABC News analyzes the redistricting fallout from the Supreme Court's Callais v. Louisiana ruling, which severely weakened Section 2 of the Voting Rights Act. Because most states have already passed candidate filing deadlines for November's midterms, the immediate 2026 impact is limited. Georgia Gov. Brian Kemp confirmed he will not suspend the state's May 19 primary but said new maps will be required for 2028. South Carolina Republicans have discussed eliminating the state's one Democratic-held seat, though some lawmakers are skeptical of acting before 2026. One Republican redistricting operative told ABC News that as many as 70 seats could be redrawn nationally by 2028. House Minority Leader Hakeem Jeffries pledged Democratic counter-efforts in New York, Illinois, Maryland, and Colorado for 2028. Based on mid-decade redistricting already completed, Republicans are currently favored to gain 13 districts across five states versus Democrats' gains of 10 across three.",KE,Yes
b012,politics,abcnews.com,https://abcnews.com/Politics/house-approves-bill-fund-dhs/story?id=132541961,"The House passed the Senate-backed DHS funding bill by voice vote on April 30, 2026, with President Trump signing it the same day, ending the longest agency shutdown in history after 76 days. The legislation restores funding for TSA, FEMA, the Coast Guard, the Secret Service, and CISA, but explicitly excludes ICE and parts of CBP. Speaker Johnson had previously called the Senate bill a ""joke"" and resisted it for weeks, but ultimately reversed course under pressure from centrist Republicans, DHS Secretary Markwayne Mullin's warnings that emergency funds were nearly exhausted, and a looming congressional recess. More than 1,000 TSA officers had quit during the shutdown. Republicans are now pursuing ICE and CBP funding through budget reconciliation, with a June 1 deadline set by Trump. The shutdown originally began amid Democratic demands for ICE reforms following the fatal shooting of two U.S. citizens by federal agents in Minneapolis.",KE,Yes
b013,politics,abcnews.com,https://abcnews.com/Politics/trump-announces-25-tariff-cars-trucks-eu/story?id=132576722,"President Trump announced on May 1, 2026, via Truth Social that he would impose a 25% tariff on European Union cars and trucks ""next week,"" accusing the EU of failing to comply with a July 2025 bilateral trade deal that had set tariffs at 15%. Trump appeared to invoke Section 232 authority, which allows the executive to adjust imports threatening national security, though the White House did not specify the legal basis in the announcement. The announcement puts the July 2025 trade agreement in jeopardy; the EU had already postponed a ratification vote over earlier tariff changes. The move comes in a complicated legal context — the Supreme Court struck down Trump's IEEPA-based tariffs in February, after which Trump replaced them with a 10% global tariff under Section 122 of the Trade Act of 1974, later raised to 15%. Trump claimed over $100 billion in U.S. manufacturing investment was underway, and offered a zero-tariff carveout for EU automakers who produce vehicles in American plants.",KE,Yes
b014,politics,abcnews.com,https://abcnews.com/Politics/60-day-war-powers-deadline-falls-friday-happen/story?id=132554486,"ABC News reports on the May 1, 2026, expiration of the 60-day War Powers Resolution deadline for the Iran war, which began February 28. The Trump administration argued the ceasefire that took effect April 7 paused or terminated the clock, allowing the president to bypass the requirement to seek congressional authorization. Defense Secretary Pete Hegseth called congressional dissenters ""defeatists from the cheap seats."" Congress departed for a weeklong recess without taking action. The Senate rejected a Democratic war powers resolution for the sixth time by a vote of 50–47, with Sen. Susan Collins crossing party lines for the first time. Some Republicans are now interpreting the law's 30-day troop-withdrawal extension as providing Trump additional time, despite that provision being intended for safe withdrawal of forces. More Democratic war powers attempts are expected after the recess, and there is limited but growing Republican appetite for an authorization for the use of military force (AUMF).",KE,Yes
b015,politics,abcnews.com,https://abcnews.com/Politics/house-passes-3-year-fisa-reauthorization-face-challenges/story?id=132516696,"The House voted 235–191 on April 29, 2026, to pass a three-year reauthorization of Section 702 of the Foreign Intelligence Surveillance Act, the warrantless surveillance authority set to expire April 30. To secure conservative votes, House leadership attached a ban on the Federal Reserve issuing a central bank digital currency (CBDC) — a provision Senate Majority Leader Thune immediately called a ""poison pill"" and ""dead on arrival"" in the upper chamber. The Senate instead advanced a clean 45-day extension to buy time for negotiations, which both chambers ultimately passed and sent to Trump for signature, preventing a lapse. The House bill included modest reforms — additional civil liberties oversight, increased criminal penalties for misuse, and broader congressional access to FISA court proceedings — but critics argued it failed to address the core warrant debate for queries on Americans' communications.",KE,Yes
b016,politics,abcnews.com,https://abcnews.com/Politics/louisianas-congressional-primaries-delayed-light-scotus-map-decision/story?id=132535661,"Louisiana Governor Jeff Landry and Attorney General Liz Murrill announced April 30, 2026, that the state's May 16 congressional House primaries would be suspended after the Supreme Court struck down Louisiana's existing congressional map as an unconstitutional racial gerrymander. Because the court's stay over the map automatically terminated with the ruling, Louisiana is legally prohibited from using the current map for any election. Absentee ballots had already been mailed and some votes likely cast. The legislature, in session until June 1, will redraw new maps; a new primary is targeted for July 15. Attorney General Murrill filed with the Supreme Court seeking further guidance. Prominent Democratic election attorney Marc Elias filed a legal challenge to Landry's suspension order. The Senate primary, including incumbent Sen. Bill Cassidy vs. Rep. Julia Letlow (Trump-endorsed), continues as scheduled. Trump praised Landry for ""moving so quickly.""",KE,Yes
b017,politics,abcnews.com,https://abcnews.com/Politics/trump-doubles-86-mob-term-murder-after-comey/story?id=132526395,"Following former FBI Director James Comey's April 29, 2026, federal indictment and April 30 court appearance in the Eastern District of Virginia, President Trump posted on social media doubling down on his claim that ""86"" is a ""mob term for 'kill him,'"" insisting the beach seashell photo Comey posted on Instagram reading ""86 47"" was an explicit threat against him. Trump added the phrase ""EIGHT MILES OUT, SIX FEET DOWN"" as his own interpretation of the numbers and called Comey a ""Dirty Cop."" Comey self-surrendered, did not enter a plea, and faces two charges: threatening the president and transmitting a threat in interstate commerce, each carrying up to 10 years. Despite his inflammatory social media posts, Trump hedged when asked directly whether he believed his life was in danger, saying ""Probably, I don't know."" Merriam-Webster and American Heritage both define ""86"" primarily as a term meaning to refuse service or remove someone, not as a threat of violence.",KE,Yes
b018,politics,abcnews.com,https://abcnews.com/Politics/house-republicans-narrowly-approve-blueprint-fund-ice-cbp/story?id=132534420,"House Republicans narrowly passed a budget resolution 215–211 on April 29, 2026, providing the framework needed to fund ICE and CBP through the remainder of Trump's term via budget reconciliation — a party-line process that bypasses the Senate filibuster. The vote was held open for more than five hours as Speaker Johnson worked to secure reluctant holdouts; one Republican voted present. The resolution was a prerequisite Johnson had set before moving the broader DHS funding bill. Republicans plan to use the reconciliation process to deliver approximately $70 billion for immigration enforcement agencies, meeting Trump's June 1 deadline. Several conservatives had previously blocked the measure, insisting on coupling ICE and CBP funding with additional policy riders such as the SAVE Act voter identification legislation. The resolution does not itself provide funds — it is the first step in a weeks-long legislative process to produce the final reconciliation bill.






",KE,Yes
b019,politics,abcnews.com,https://abcnews.com/Politics/maine-gov-janet-mills-suspends-us-senate-campaign/story?id=132531832,"Maine Governor Janet Mills announced on April 30, 2026, that she is suspending her U.S. Senate campaign, citing an inability to match her primary opponent's fundraising. Mills had been recruited by Senate Minority Leader Chuck Schumer, who viewed the two-term governor as Democrats' strongest candidate to unseat Republican Sen. Susan Collins. However, Mills was consistently outpaced by progressive challenger Graham Platner — an oyster farmer and military veteran who raised roughly $1.4 million more than Mills in Q1, holds approximately $1.7 million more cash on hand, and led her by a wide margin in polls. The announcement came one day before the Maine Democratic Convention and five weeks before the June 9 primary, effectively clearing the Democratic field for Platner. Mills did not immediately endorse Platner in her statement. Platner, who has the backing of Sen. Bernie Sanders, now faces Collins — who is seeking a sixth term in a state Trump lost by 7 points in 2024 — as the likely Democratic nominee. The race is considered one of Democrats' top targets in their push to retake the Senate majority.",KE,Yes
b020,politics,www.npr.org,https://www.npr.org/2026/04/30/nx-s1-5380988/dhs-shutdown-tsa-funding-ice,"NPR's April 30, 2026, report covers the end of the 75-day DHS shutdown after the House passed, and Trump signed, a funding bill that restored most agency operations — including TSA, FEMA, the Coast Guard and the Secret Service — but excluded new money for ICE and CBP. House Speaker Johnson had resisted the Senate-passed bill for weeks before centrist pressure and a pre-recess deadline forced the vote. Republicans now plan to fund ICE and CBP through budget reconciliation, a party-line process. The shutdown had caused historic airport delays, a backlog of merchant mariner credentials, unpaid utility bills at Coast Guard stations, and warnings from DHS Secretary Markwayne Mullin that the agency was running out of money.",KE,Yes
b021,politics,www.npr.org,https://www.npr.org/2026/04/29/nx-s1-5380205/supreme-court-voting-rights-act-louisiana-redistricting,"NPR's April 29, 2026, report covers the Supreme Court's 6-3 ruling in Callais v. Louisiana, which reinterpreted Section 2 of the Voting Rights Act to require proof of intentional racial discrimination rather than discriminatory effect alone. Justice Samuel Alito wrote for the majority that Louisiana's second majority-Black congressional district constituted an unconstitutional racial gerrymander. The ruling is the latest in a series of decisions that have systematically weakened the landmark 1965 civil rights law. Election law expert Rick Hasen called it ""one of the most important and most pernicious decisions of the Supreme Court in the last century."" The state must now redraw its congressional map, and Louisiana has already suspended its May 16 primary elections. Republicans in Tennessee, Georgia, and Alabama quickly called for redistricting to capitalize on the ruling.",KE,Yes
b022,politics,www.npr.org,https://www.npr.org/2026/05/01/nx-s1-5806260/trump-medicaid-work-requirements-nebraska-big-beautiful-bill-hr1-obbba,"Nebraska became the first state on May 1, 2026, to enforce Medicaid work requirements mandated under the One Big Beautiful Bill Act that Trump signed in July 2025. Under the program, able-bodied adults ages 19–64 enrolled in Medicaid expansion must work, train, or attend school for at least 80 hours per month, or earn $580 monthly. Nebraska launched the program eight months ahead of the federally mandated 2027 deadline. The Urban Institute estimates around 25,000 Nebraskans could lose coverage. Health advocates, hospitals, and patients expressed deep concern about the rollout, citing confusion over notification letters, limited exemptions for medical conditions, and fears about health coverage gaps. The state has about 72,000 residents subject to the policy.",KE,Yes
b023,politics,www.npr.org,https://www.npr.org/2026/05/01/nx-s1-5805805/may-day-protests-boycott-schools-trump,"Thousands of demonstrators turned out across the United States on May 1, 2026, for ""May Day Strong"" protests organized by more than 500 labor unions, student groups, and community organizations. Organizers, including the National Education Association with 3 million members, called for a boycott of work, school, and shopping to protest Trump administration policies and what they described as a billionaire takeover of government. The protests followed the nationally prominent ""No Kings"" demonstrations earlier in 2026. Over 100,000 students were expected to miss school, per the Sunrise Movement. In North Carolina alone, some 20 school districts closed due to anticipated staff absences. Cities including Boston, New York, Washington DC, Chicago, Los Angeles, and Seattle all held events.",KE,Yes
b024,politics,www.npr.org,https://www.npr.org/2026/05/01/nx-s1-5807098/myanmar-suu-kyi-house-arrest,"State television in Myanmar announced on May 1, 2026, that deposed opposition leader Aung San Suu Kyi, 80, had been transferred from prison to house arrest — the first news of her in years — as part of a Buddhist holiday prisoner amnesty. The transfer came under orders from President Min Aung Hlaing, the military general who led the 2021 coup against Suu Kyi's elected government. The location of her new residence was not disclosed. The announcement included a photograph of Suu Kyi — the first public image of her since shortly after the coup. Her son Kim Aris called the move a ""calculated gesture"" and noted he still had no confirmed information about her wellbeing. Analysts say the move reflects Min Aung Hlaing's desire to improve Myanmar's diplomatic standing with ASEAN and China following his installation as civilian president after a widely discredited election in April.",KE,Yes
b025,politics,www.npr.org,https://www.npr.org/2026/05/01/nx-s1-5807081/prosecutors-release-video-of-armed-man-storming-correspondents-dinner,"Federal prosecutors released surveillance video on May 1, 2026, showing Cole Tomas Allen, a 31-year-old teacher from Torrance, California, sprinting through a security checkpoint with a shotgun at the Washington Hilton hotel during the White House Correspondents' Dinner on April 25. DC US Attorney Jeanine Pirro posted the video, confirming Allen fired at a Secret Service officer and that there is no evidence of friendly fire striking the agent. Earlier footage shows Allen casing the hotel the day before the attack. Prosecutors say Allen wrote a ""manifesto"" describing himself as a ""Friendly Federal Assassin"" and planned to target Trump administration officials from highest-ranking to lowest. Allen was charged with attempted assassination of the president. His defense team argues the government's case relies on speculation about intent.",KE,Yes
