id,category,source,url,reference_summary,who,done
b026,politics,apnews.com,https://apnews.com/article/cuba-may-1-power-workers-outages-union-petroleum-9ecb9f1c31357cb0b599869d3c49d31b,"Tens of thousands of Cubans marched along Havana's Malecón seawall on May 1, 2026, honoring the country's Electric Union and petroleum workers, who have been working around the clock as the island's power grid continues to deteriorate. Cuba's energy crisis worsened after the U.S. energy blockade cut off fuel supplies during the Iran war. Officials said the government was distributing only 800 of the 1,600 daily tons of fuel needed, with Russian oil expected to run out by end of April. Some petroleum was converted to diesel and fuel oil to power hospitals and generators. Cuba's energy minister warned the priority was keeping thermoelectric plants running on domestic crude. The May Day rally, attended by former President Raúl Castro, was framed around national solidarity in the face of U.S. sanctions and the fuel shortage.",KE,Yes
b027,politics,apnews.com,https://apnews.com/article/onion-infowars-takeover-alex-jones-4971bd1a33c5a88857e073ee02fe5f8e,"The Onion's plan to take over Alex Jones's Infowars media platforms and convert them into parody sites was thrown into legal limbo on April 30, 2026, after the Texas Third Court of Appeals granted Jones's lawyers an emergency stay blocking the transfer of any Infowars assets to a state-appointed receiver. The Onion had hoped to license the Infowars brand and use proceeds to pay Sandy Hook victims' families, who hold over $1.3 billion in defamation judgments against Jones for calling the 2012 school shooting a hoax. Sandy Hook families' attorneys immediately appealed to the Texas Supreme Court, which had not ruled before a scheduled lower-court hearing. The hearing was reduced to a status conference, with the next date set for May 28. Jones declared the appeals court ruling a victory and confirmed he is building a new studio and media operation outside of Infowars.",KE,Yes
b028,politics,apnews.com,https://apnews.com/article/retirement-plan-matching-contribution-401k-trump-employers-e46469b15f1cb4af025bddb2e0363734,"President Trump signed an executive order on April 30, 2026, directing the creation of a new government website — TrumpIRA.gov — to help workers whose employers do not offer retirement plans find and compare private-sector IRA accounts. The order is intended to connect more lower-income workers to the federal Saver's Match program, which starts in 2027 and will offer matching contributions of up to $1,000 for single filers earning less than $35,500 a year, and up to $2,000 for qualifying married couples. The Saver's Match provision originated from the 2022 SECURE 2.0 Act passed under President Biden. Trump noted at the signing that roughly half of American workers lack access to employer-sponsored retirement plans with matching contributions. He also called on Congress to expand eligibility beyond the current income threshold.",KE,Yes
b029,politics,apnews.com,https://apnews.com/article/trump-war-powers-pentagon-iran-422311a4443b987af87cd4ca35d54f48,"As the War Powers Resolution's 60-day deadline arrived on May 1, 2026, the Trump administration argued the Iran war had already ""terminated"" due to the ceasefire that began April 7, eliminating any obligation to seek congressional authorization. A senior official said hostilities that began February 28 had ended because no shots had been exchanged between U.S. and Iranian forces since April 7. Defense Secretary Pete Hegseth had previewed the argument in Senate testimony Thursday, claiming the ceasefire ""pauses or stops"" the clock. Legal experts called the interpretation unprecedented, noting the law's text contains no provision for pausing the 60-day deadline during a ceasefire, especially while the U.S. maintains a naval blockade that Iran considers an act of war. Congressional Republicans largely deferred to the White House, with the Senate already having rejected six Democratic war powers resolutions to end the conflict.",KE,Yes
b030,politics,apnews.com,https://apnews.com/article/trump-surgeon-general-saphier-means-2fb65edf047650258d1a2b54617a10da,"President Trump on April 30, 2026, withdrew his nomination of Dr. Casey Means as surgeon general and announced he would nominate Dr. Nicole Saphier, a radiologist and longtime Fox News contributor, as his replacement — his third pick for the role. Means's nomination stalled after tense Senate confirmation hearings in which lawmakers from both parties questioned her credentials and her position on vaccines, making it clear she lacked the votes to advance out of the Senate Health, Education, Labor, and Pensions Committee. Saphier is the director of breast imaging at Memorial Sloan Kettering Monmouth and holds a medical degree from Ross University. Health Secretary Robert F. Kennedy Jr. endorsed the pick, calling her a ""long-time warrior for the MAHA movement,"" though some MAHA influencers are skeptical of her alignment with the agenda. Trump's first surgeon general nominee, Dr. Janette Nesheiwat, was also withdrawn after questions about her academic credentials.",KE,Yes
b031,business,www.cnbc.com,https://www.cnbc.com/2026/05/01/spirit-airlines-trump-bailout.html,"President Trump announced on May 1 that his administration had submitted a ""final"" bailout proposal to Spirit Airlines' bondholders, as the struggling budget carrier faces imminent liquidation. The government's offer — reportedly involving a $500 million loan that could give the federal government up to a 90% equity stake — had not yet produced a deal with creditors. Trump said he would only proceed ""if it's a good deal,"" comparing the potential intervention to the government's stake in Intel. Spirit, currently in its second Chapter 11 bankruptcy in under a year, has seen its finances further squeezed by the Iran war's spike in jet fuel prices. Critics from both parties questioned the use of taxpayer funds for a single failing carrier. United Airlines CEO Scott Kirby publicly opposed the bailout, arguing that Spirit's business model was fundamentally flawed even before the fuel crisis. If no deal is reached, Spirit could be forced to liquidate within days.",KE,Yes
b032,business,www.cnbc.com,https://www.cnbc.com/2026/05/01/trump-eu-auto-tariffs.html,"President Trump announced on May 1 via Truth Social that he would raise tariffs on European Union cars and trucks to 25% the following week, accusing the EU of failing to comply with a previously negotiated trade framework. The announcement came without specifying the legal authority for the increase. The Supreme Court struck down Trump's broad ""reciprocal"" IEEPA tariffs earlier in 2026, after which Trump imposed a 10% global tariff under Section 122 of the Trade Act, later raised to 15%. The EU had already been moving slowly on ratifying its trade deal with the U.S. and had warned the agreement could be at risk. The automakers most exposed to the new tariff would be Mercedes-Benz, BMW, and Volkswagen, which import a large share of U.S.-sold vehicles from European factories. The announcement threatened to further escalate already strained U.S.-EU trade relations.",KE,Yes
b033,business,www.cnbc.com,https://www.cnbc.com/2026/05/01/kentucky-derby-prediction-platforms.html,"Prediction market platforms like Kalshi and Polymarket will not offer contracts on the 2026 Kentucky Derby, and this article explains why. Under the Interstate Horseracing Act of 1978, offering wagers on horse races legally requires explicit permission from the host racetrack, the horsemen's association, and state racing regulators. Churchill Downs CEO Bill Carstanjen told CNBC the company has no interest in cutting such a deal with prediction platforms. Additionally, Kentucky lawmakers have proposed legislation that would ban gambling licensees from offering race predictions and imposed a 17.5% tax on prediction market fees. Traditional wagering through Churchill Downs is, meanwhile, pacing ahead of expectations going into Derby weekend. The article also notes that CNBC has a disclosed commercial relationship with Kalshi.",KE,Yes
b034,business,www.cnbc.com,https://www.cnbc.com/2026/05/01/apollo-sports-capital-tom-dundon-pickleball-investment.html,"Pickleball Inc. — the newly formed parent company of Major League Pickleball (MLP) and the PPA Tour — announced a landmark $225 million investment led by Apollo Sports Capital (an investment platform of Apollo Global Management) and Dundon Capital Partners, owned by NBA Trail Blazers and NHL Hurricanes owner Tom Dundon. The raise values Pickleball Inc. at $750 million and brings total investment in the company to $315 million. It creates what the company describes as the largest pickleball ecosystem in existence, spanning professional play, retail, technology, court construction, and media. Dundon and the Pardoe family remain majority shareholders. Pickleball has been the fastest-growing sport in the U.S. for five consecutive years, with 24 million players in 2025. The MLP and PPA Tour recorded combined revenue of $60 million in 2025 and are projecting $74 million in 2026.",KE,Yes
b035,business,www.cnbc.com,https://www.cnbc.com/2026/04/30/rivian-renegotiates-doe-loan-adjusts-capacity-plans-for-georgia-plant.html,"Rivian announced on April 30 that it has renegotiated its Department of Energy loan from the original $6.57 billion (negotiated under the Biden administration) down to $4.5 billion, while simultaneously increasing the planned initial production capacity of its under-construction Georgia factory from 200,000 to 300,000 vehicles annually. The amended deal covers one phase of production and allows Rivian to begin drawing on the loan sooner — as early as early 2027 — than previously expected. CEO RJ Scaringe told CNBC that any future expansion beyond 300,000 units would be funded by the company itself, leveraging capital from partnerships with Volkswagen and Uber. Production of the R2 midsize EV at the Georgia facility remains on track to begin in late 2028. The renegotiation reflects ongoing uncertainty in EV demand and the Trump administration's broader effort to scale back Biden-era clean energy loan commitments.",KE,Yes
b036,business,www.cnbc.com,https://www.cnbc.com/2026/04/30/eli-lilly-foundayo-prescriptions-20000-people-taking-drug-ricks-says.html,"Eli Lilly CEO Dave Ricks told CNBC on April 30 that more than 20,000 people have started taking Foundayo — the company's newly launched once-daily oral GLP-1 weight-loss pill — in the first few weeks since its April 9 launch, with over 1,000 new prescriptions being written daily. Crucially, more than 80% of Foundayo patients are new to GLP-1 medications entirely, suggesting the pill is expanding the obesity drug market rather than cannibalizing Lilly's injectable franchise. Ricks noted that Lilly has not yet begun full consumer advertising for the drug; that is planned for later in 2026. Early prescription volume had been lower than some analysts expected compared to the launch of Novo Nordisk's rival Wegovy pill, but Ricks said the comparison was unfair given that Foundayo is a completely new molecule building its brand from scratch. The disclosure came alongside Lilly's Q1 2026 earnings beat, with revenue of $19.8 billion — a 56% year-over-year increase — and raised full-year guidance of $82–$85 billion.",KE,Yes
b037,business,www.cnbc.com,https://www.cnbc.com/2026/04/30/ai-legal-advice-lawyers-risks.html,"A CNBC Inside Wealth report finds that lawyers serving high-net-worth clients are increasingly dealing with clients who have sought legal advice from AI chatbots like ChatGPT and Claude. Attorneys say this trend creates practical and legal headaches: AI-generated legal suggestions are often incorrect or irrelevant to the client's specific circumstances, leading to hours of billable time spent explaining why the AI was wrong. Robert Strauss of Weinstock Manion described clients uploading trust documents and returning with AI-generated edit suggestions — none of which had been actionable. More seriously, a recent court ruling found that communications with Claude about a legal matter were not protected by attorney-client privilege, since the user had voluntarily shared confidential information with a third party. The article notes that ""garbage in, garbage out"" is a persistent problem when clients query AI tools without the legal expertise to frame prompts correctly.",KE,Yes
b038,business,www.cnbc.com,https://www.cnbc.com/2026/04/30/hershey-gum-mints-ozempic-breath.html,"Hershey reported during its Q1 2026 earnings that sales of its Ice Breakers gum and mint brand rose more than 8% year-over-year, which CEO Kirk Tanner attributed to rising adoption of GLP-1 weight-loss drugs. The likely mechanism: a phenomenon known as ""Ozempic breath"" — a side effect of GLP-1 medications linked to dry mouth, dehydration, and altered digestion — is prompting users to reach for breath fresheners. While GLP-1 makers do not officially list bad breath as a side effect, medical experts link the drugs to dry mouth and halitosis. Protein bar sales at Hershey also jumped 17%, and GLP-1 users continue buying candy, particularly smaller-portion products. Separately, Lindt and Magnum Ice Cream have also reported that GLP-1 users favor premium, smaller-format confectionery — a trend analysts are calling the ""premium treat substitution effect."" Hershey's overall Q1 revenue rose more than 10%.",KE,Yes
b039,business,www.cnbc.com,https://www.cnbc.com/2026/04/29/chipotle-mexican-grill-cmg-q1-2026-earnings.html,"Chipotle Mexican Grill reported Q1 2026 results that beat Wall Street expectations, with comparable restaurant sales rising 0.5% — reversing a string of recent declines and surpassing analyst forecasts of a 0.7% drop. Total revenue grew 7.4% year-over-year to $3.09 billion, driven primarily by new restaurant openings and a return to positive transaction growth (+0.6%). Net income fell 22% year-over-year to $302.8 million due to higher beef and freight costs and legal expenses; adjusted EPS of $0.24 was in line with estimates. CEO Scott Boatwright credited the turnaround to menu innovation, expanded digital sales (38.6% of total), and a loyalty program that now accounts for 32% of sales. Chipotle maintained full-year guidance of roughly flat same-store sales with Q2 expected around +1%. Shares rose roughly 3% in after-hours trading.",KE,Yes
b040,business,www.cnbc.com,https://www.cnbc.com/2026/04/29/paypal-restructures-venmo-standalone-unit.html,"In an exclusive reported by CNBC, PayPal CEO Enrique Lores — who joined from HP in March — is restructuring the company into three separate business segments: a PayPal-branded consumer and merchant business, a standalone Venmo unit, and a payment services arm encompassing Braintree and crypto. Making Venmo a standalone segment gives PayPal greater transparency into its performance and could facilitate a potential sale, with Stripe among reported interested buyers. Venmo, with nearly 100 million users, is considered PayPal's most valuable standalone asset. Two senior executives are departing in the shake-up: Diego Scotti, who oversaw the consumer group that included Venmo, and Michelle Gill, who ran a small business unit being wound down. PayPal is also establishing an AI transformation group under Walmart tech veteran Anshu Bhardwaj. PayPal shares rose about 2.5% on the news.",KE,Yes
b041,business,www.cnbc.com,https://www.cnbc.com/2026/04/28/jetblue-fort-lauderdale-flights.html,"JetBlue Airways told investors on April 28 that it is pressing ahead with expansion at Fort Lauderdale-Hollywood International Airport — Spirit Airlines' longtime home hub — regardless of Spirit's uncertain fate. All of JetBlue's Q2 capacity growth is being directed to Fort Lauderdale, where the airline's market share has grown to over 20% as Spirit has cut capacity during bankruptcy. JetBlue CEO Joanna Geraghty said the airline is open to government fuel cost assistance ""if the terms make sense"" but is not banking on a Spirit collapse. The Association of Value Airlines separately sought $2.5 billion from the Trump administration for the sector-wide fuel cost spike tied to the Iran war. The article situates JetBlue's Fort Lauderdale push within the broader airline industry scramble to capture Spirit's market share amid a possible liquidation.",KE,Yes
b042,business,www.cnbc.com,https://www.cnbc.com/2026/04/28/gm-iran-war-vehicle-sales.html,"General Motors reported Q1 2026 earnings that beat expectations but raised only modest guidance, as the Iran war's impact on commodity and logistics costs prevented a larger upgrade. Average transaction prices held at $52,000 — in line with a year ago — as consumer demand for pricier trucks and SUVs remained resilient despite gasoline above $4 per gallon. CEO Mary Barra said the key variable is how long the conflict lasts and what further disruptions it causes. GM also diverted approximately 7,500 full-size SUVs — including Tahoes, Suburbans, and Escalades — originally destined for Middle Eastern markets back to North America. GM received a $500 million tariff refund from the administration's portal for duties struck down by the Supreme Court, which partially offset war-related cost pressures. CFO Paul Jacobson told CNBC that dealership traffic remained steady through March and April.",KE,Yes
b043,business,www.cnbc.com,https://www.cnbc.com/2026/04/28/resorts-world-casino-opens-in-new-york-city.html,"Resorts World New York City opened on April 28 as the first full-scale casino with live table games in New York City's history, following state gaming commission approval. Located in Ozone Park, Queens, adjacent to the Aqueduct Racetrack, the expanded facility features more than 240 table games — including blackjack, craps, baccarat, and roulette — and over 2,500 slot machines. Rapper Nas, a partner in the expansion, joined Genting Chairman Lim Kok Thay and Queens Borough President Donovan Richards for the ceremonial opening. The casino currently employs over 2,200 people and plans to grow to 2,700 by summer. It holds a temporary market monopoly; Hard Rock's Metropolitan Park near Citi Field and Bally's Bronx project are not expected to open until around 2030. Resorts World pays 63% state tax on slots revenue and 30% on table games, with provisions to lower those rates once competitors open.",KE,Yes
b044,business,abcnews.com,https://abcnews.com/Business/wireStory/superdry-cofounder-james-holder-convicted-rape-after-night-132566956,"James Holder, 54, co-founder of the UK fashion brand Superdry, was convicted on May 1 by a jury at Gloucester Crown Court of one count of rape stemming from a May 2022 incident in Cheltenham, England. He was acquitted of a separate charge of assault by penetration. The victim testified that Holder, who had been out drinking with colleagues, entered her taxi uninvited, accompanied her into her home, and assaulted her after waking from a nap — continuing despite her pleas to stop. Holder, a married father of two, denied all charges, claiming any sexual activity was consensual. He was jailed pending sentencing at Bristol Crown Court on May 7. Superdry, which Holder co-founded in 2003, was delisted from the London Stock Exchange in 2024 following a sales decline and has since rebranded as Superdry & Co.",KE,Yes
b045,business,abcnews.com,https://abcnews.com/Business/uber-rolls-new-travel-features-hotel-booking-eats/story?id=132465202,"At its annual GO-GET product showcase in New York City, Uber announced a major expansion into travel services, led by a new partnership with Expedia Group to offer hotel booking directly in the Uber app. Users can now access more than 700,000 hotels globally, with Uber One members receiving at least 20% discounts and 10% back in Uber credits. Additional features include an upgraded Travel Mode with curated dining and local recommendations; an in-car Uber Eats option for Uber Black rides; integration with OpenTable for restaurant reservations; and an AI-powered voice booking assistant. Vrbo vacation rentals will be added later in the year. Uber CEO Dara Khosrowshahi — a former Expedia CEO — positioned the partnership as a major step toward making Uber an ""everything app,"" noting that more than 100 million people use Uber to travel to or from an airport annually.",KE,Yes
b046,business,abcnews.com,https://abcnews.com/Business/stock-market-shrugging-off-iran-war-experts-explain/story?id=132450314,"Despite the Iran war triggering the worst oil supply shock in history and driving U.S. gasoline prices to four-year highs, the S&P 500 has climbed more than 3% since hostilities began on Feb. 28, with the tech-heavy Nasdaq up nearly 8%. This article from ABC News surveys analysts to explain the divergence. Key reasons cited include: robust corporate earnings across most sectors; a smaller-than-feared economic fallout from the Strait of Hormuz closure; strong tech spending; and ceasefire-driven optimism since April 7 that has pushed the S&P 500 up nearly 7%. Brent crude was trading around $119 a barrel at the time of publication, with the Strait still effectively closed. Analysts cautioned that the longer the war drags on and oil remains scarce, the greater the risk of a more severe market correction, particularly if supply disruptions begin materially hitting company earnings.",KE,Yes
b047,business,abcnews.com,https://abcnews.com/Business/fed-expected-hold-interest-rates-steady/story?id=132450311,"The Federal Reserve kept interest rates unchanged for a third consecutive meeting in 2026, maintaining the benchmark rate at 3.5–3.75%, as energy-driven inflation and war uncertainty complicate the path forward. The decision was nearly unanimous, with four total dissents — the most since 1992 — three of which objected to the retention of an easing bias in the policy statement. In a post-meeting press conference, Chair Jerome Powell confirmed it was his last as Fed chair and that he would remain on the Fed's board as a governor to monitor the resolution of a DOJ renovation probe. Earlier the same day, the Senate Banking Committee advanced Kevin Warsh's nomination as the next Fed chair in a party-line 8-4 vote, clearing the path to a full Senate confirmation vote. Powell congratulated Warsh and pledged to keep a ""low profile"" as a governor, insisting he did not intend to be a ""shadow chair"" or undermine his successor.",KE,Yes
b048,business,abcnews.com,https://abcnews.com/Business/fed-chair-nominee-kevin-warsh-advances-senate-confirmation/story?id=132490998,"Kevin Warsh's nomination to lead the Federal Reserve cleared the Senate Banking Committee in a party-line 8-4 vote on April 29, setting the stage for a confirmation vote in the full Republican-controlled Senate. The path was cleared after the DOJ dropped a criminal investigation into current Chair Jerome Powell, removing the objection that had threatened to hold up the nomination by Sen. Thom Tillis. Warsh, a former Fed governor and Hoover Institution fellow, has called for ""regime change"" at the Fed — meaning a rethinking of inflation measurement, forward guidance, and communications policy, not personnel firings. He has expressed openness to rate cuts, citing AI-driven productivity gains, but denied making promises to Trump. Democrats on the committee accused Warsh of being a political actor, with Sen. Elizabeth Warren calling him a ""sock puppet"" for the president. Warsh is expected to be confirmed before Powell's term as chair ends on May 15.",KE,Yes
b049,business,abcnews.com,https://abcnews.com/Business/us-gasoline-prices-hit-highest-level-4-years/story?id=132459162,"U.S. average gasoline prices reached $4.30 per gallon — their highest level since 2022 — driven by the Iran war's disruption of Strait of Hormuz oil transit, which the International Energy Agency called the ""largest oil supply disruption in history."" The article covers the national impact on consumers and businesses, noting that energy prices rose 10.9% in March and are complicating the Fed's inflation outlook. California prices were significantly above the national average. The spike is straining household budgets and squeezing businesses that depend on transportation and logistics. The article notes that prolonged supply disruption could risk recession territory, and quotes economists who are divided on how long the oil shock will persist. The ongoing U.S. naval blockade of Iranian ports has further tightened global supply beyond the initial Strait disruption.",KE,Yes
b050,business,abcnews.com,https://abcnews.com/Business/united-arab-emirates-leave-opec/story?id=132450800,"The United Arab Emirates announced its withdrawal from OPEC, effective May 1, 2026 — the most significant departure from the oil cartel since Qatar's exit in 2019. The UAE, previously OPEC's third-largest producer after Saudi Arabia and Iraq, cited national interest and its goal of boosting production capacity to 5 million barrels per day by 2027, a target constrained by OPEC's production quotas. The decision also came amid deep frustration over Iran's attacks on UAE territory and shipping during the war. The UAE's energy minister said the move was timed to minimize disruption to the group and fellow members. Analysts see the departure as both a commercial move — to maximize revenue as the UAE prepares for a post-fossil-fuel era — and a geopolitical signal, aligning the UAE more closely with the U.S. and Israel following the Abraham Accords.",KE,Yes
