id,category,source,url,reference_summary,who,done
a061,technology,www.bbc.com,https://www.bbc.com/future/article/20260429-finding-hidden-sperm-new-technology-offers-hope-to-men-previously-told-they-were-infertile,Columbia University Fertility Center developed an AI system called STAR (Sperm Tracking and Recovery) that scans over 8 million images per hour using high-powered imaging and microfluidic chips to identify and isolate viable sperm in men diagnosed with azoospermia. The technology led to the first AI-assisted conception and offers new hope to the roughly 40% of infertile couples where male factors are the cause.,W,yes
a062,technology,www.bbc.com,https://www.bbc.com/future/article/20260428-ai-companies-want-you-to-be-afraid-of-them,"Some AI companies, including Anthropic, have been releasing highly restricted previews of powerful models while publicly warning of their potential dangers. Commentators argue this fear marketing serves a dual purpose — generating public attention while signaling capability to enterprise clients. The article urges readers to view AI risk narratives from companies with healthy skepticism.",W,yes
a063,technology,www.bbc.com,https://www.bbc.com/future/article/20260421-your-bad-habits-are-destroying-your-charging-cables,"Research from the University of Maryland's Centre for Advanced Life Cycle Engineering found that charging cables fail primarily due to daily usage habits, not how they are stored or wrapped. The key culprit is pulling the cable body rather than gripping the connector head when unplugging. Experts say treating the connector with care can dramatically extend cable lifespan.",W,yes
a064,technology,www.cnbc.com,https://www.cnbc.com/2026/05/01/apple-ceo-warns-of-memory-crunch-well-look-at-a-range-of-options.html,"During Apple's Q2 earnings call, CEO Tim Cook warned that soaring global demand for AI server memory is creating supply constraints that will significantly impact Apple's business. Memory costs were already a headwind in the March quarter and will worsen considerably in the June quarter and beyond. The company is evaluating a range of responses but declined to offer specifics.",W,yes
a065,technology,www.cnbc.com,https://www.cnbc.com/2026/04/30/veeva-systems-will-join-sp-500-index-replacing-coterra-energy.html,"Life sciences cloud software provider Veeva Systems will join the S&P 500 on May 7, replacing Coterra Energy, which is being acquired by Devon Energy. Despite being down roughly 30% year-to-date amid AI disruption fears, Veeva's stock surged approximately 9% on the announcement, as index inclusion typically drives passive fund inflows.",W,yes
a066,technology,www.cnbc.com,https://www.cnbc.com/2026/04/30/investor-jack-selby-markets-underpricing-middle-east-ai-pullback-risk.html,Investor Jack Selby cautioned that financial markets are failing to adequately price in the risk that the U.S.-Iran war and rising energy costs could trigger a pullback in AI investment. He argued that geopolitical instability and supply chain disruptions pose a systemic threat to tech sector valuations that the market has so far chosen to ignore.,W,yes
a067,technology,www.cnbc.com,https://www.cnbc.com/2026/05/01/china-ev-ai-features-price-war-bytedance-alibaba-doubao-volcano-engine.html,"China's EV price war has evolved into an AI features arms race. ByteDance's Doubao AI model is now integrated in over 50 car brands across 145 models and more than 7 million vehicles. Alibaba's Qwen AI is also rolling out in-car services in vehicles from BYD and a Volkswagen joint venture. Analysts warn that as AI features become ubiquitous, true differentiation is becoming increasingly difficult to sustain.",W,yes
a068,technology,www.cnbc.com,https://www.cnbc.com/2026/05/01/japan-airlines-humanoid-robots-haneda-labor-shortage.html,"Japan Airlines, in partnership with GMO AI & Robotics, is launching a two-year trial of humanoid robots for ground operations at Tokyo's Haneda Airport starting in May. The robots will handle tasks such as baggage loading and cargo transport. The initiative is a direct response to Japan's severe labor shortage driven by an aging population, with the country's working-age population projected to decline 31% by 2060.",W,yes
a069,technology,www.cnbc.com,https://www.cnbc.com/2026/04/30/apple-delivers-a-nearly-perfect-quarter-with-a-ceo-change-and-an-ai-update-ahead.html,"Apple posted Q2 revenue of $111.2 billion, up 17% year-over-year, marking its best March quarter ever. The earnings call was also the first since the announcement that Tim Cook will step down as CEO in September, to be succeeded by hardware engineering head John Ternus. Ternus made a brief appearance on the call, touting an incredible roadmap ahead.",W,yes
a070,technology,www.cnbc.com,https://www.cnbc.com/2026/04/30/reddits-ceo-fuel-artificial-intelligence.html,"Reddit CEO Steve Huffman argued that Reddit's vast archive of human conversations makes it an indispensable input for AI training, calling the platform the fuel for AI. The company posted Q1 revenue up 69% year-over-year to $663 million, with daily active users up 17% to 126.8 million. Huffman highlighted Reddit's asset-light model with capital expenditures of just $1 million for the quarter as a key advantage in the AI era.",W,yes
a071,technology,www.cnbc.com,https://www.cnbc.com/2026/04/30/tech-stocks-best-month-since-2020.html,"The Nasdaq Composite surged 15.29% in April, its strongest monthly performance since the start of the Covid pandemic in April 2020. Big tech earnings broadly beat expectations, with Alphabet gaining 34%, Amazon up 27%, and Broadcom up 35%. Strong cloud growth and continued AI capital expenditure commitments fueled investor confidence.",W,yes
a072,technology,www.cnbc.com,https://www.cnbc.com/2026/04/30/gemini-sets-sights-on-derivatives-expansion-after-winning-key-us-regulatory-approval.html,"Crypto exchange Gemini secured a Derivatives Clearing Organization license from the CFTC, allowing it to clear and settle derivatives trades in-house. Combined with its existing Designated Contract Market license, Gemini now has a full-stack regulated marketplace and plans to expand into crypto futures, options, and perpetual contracts for U.S. customers.",W,yes
a073,technology,www.cnbc.com,https://www.cnbc.com/2026/04/30/softbank-roze-ai-robotics-ipo-100-billion-ft-report.html,"SoftBank is planning to create and list a standalone AI and robotics company in the U.S. called Roze, which would focus on using robots to build and operate AI data centers more efficiently. CEO Masayoshi Son is driving the effort, targeting a valuation of around $100 billion and an IPO as early as the second half of 2026. Some insiders have expressed skepticism about both the valuation and timeline.",W,yes
a074,technology,www.cnbc.com,https://www.cnbc.com/2026/04/30/nvidia-backs-ai-legal-tech-legora.html,"Nvidia's venture arm NVentures invested in Swedish AI legal tech startup Legora as part of a $50 million Series D extension, bringing the total round to $600 million at a $5.6 billion valuation. It marks Nvidia's first known bet in the legal tech sector. Legora has grown to 400 employees and recently surpassed $100 million in annual recurring revenue.",W,yes
a075,technology,www.cnbc.com,https://www.cnbc.com/2026/04/29/investors-trust-google-more-than-meta-when-comes-to-spending-on-ai.html,"When both Alphabet and Meta raised their AI capital expenditure guidance in Q1 2026 earnings, Wall Street responded very differently: Alphabet's stock surged roughly 10% while Meta's fell nearly 9%. The divergence reflects a fundamental trust gap — Alphabet can point to Google Cloud's 63% revenue growth and a $460 billion backlog, whereas Meta lacks a cloud business and faces greater skepticism over its ability to convert massive AI investment into revenue.",W,yes
a076,technology,www.cnbc.com,https://www.cnbc.com/2026/04/30/samsung-q1-earnings-ai-memory-chip-demand-profit-record.html,Samsung reported record quarterly revenue of 133.9 trillion won and operating profit of 57.2 trillion won — an over eightfold increase year-over-year — driven almost entirely by its semiconductor division amid a global AI memory chip shortage. The company's memory business set a new quarterly sales record as supply constraints pushed prices sharply higher. Samsung expects the supply-demand gap to widen further through 2027.,W,yes
a077,technology,www.cnn.com,https://www.cnn.com/2026/04/30/tech/apple-earnings-john-ternus-new-ceo,"Apple's Q2 earnings call marked the first public appearance by incoming CEO John Ternus following the leadership transition announcement. Ternus thanked shareholders and pledged continuity in Apple's financial discipline while pointing to an incredible roadmap ahead. Cook, who will become executive chairman in September, advised Ternus that where he chooses to spend his time will be among his most consequential decisions.",W,yes
a078,technology,www.cnn.com,https://www.cnn.com/2026/04/30/tech/takeaways-elon-musk-openai-sam-altman-lawsuit,"After nearly three days on the stand, Musk's central argument was that OpenAI's shift from nonprofit to for-profit structure betrayed the mission he helped fund. He testified he was open to a for-profit subsidiary, but not one that would overtake the nonprofit. OpenAI's attorneys countered that Musk's suit is driven by competitive jealousy, not principle.",W,yes
a079,technology,www.cnn.com,https://www.cnn.com/2026/04/29/tech/musk-openai-altman-lawsuit-testimony-day-two,"On the second day of cross-examination, Musk sparred with OpenAI's attorney over internal emails from 2018 that suggested he was informed of plans to raise outside capital. He identified Microsoft's $10 billion investment as the turning point that convinced him the nonprofit mission had been fundamentally betrayed.",W,yes
a080,technology,www.cnn.com,https://www.cnn.com/2026/04/29/tech/openai-tumbler-ridge-canada-shooting-lawsuits,"Seven families of victims of the February school shooting in Tumbler Ridge, British Columbia filed federal lawsuits against OpenAI and CEO Sam Altman. The suits allege that OpenAI's internal systems flagged the shooter's violent ChatGPT conversations eight months before the attack, staff recommended notifying Canadian police, but leadership overruled them, reportedly citing concerns that doing so could harm the company's upcoming IPO.",W,yes
a081,technology,www.cnn.com,https://www.cnn.com/2026/04/27/tech/china-blocks-meta-manus-intl-hnk,"China's National Development and Reform Commission ordered Meta to unwind its $2 billion acquisition of Manus, a Singapore-headquartered but Chinese-founded AI startup, citing the need to protect strategically sensitive technology from transferring to the United States. The decision is widely seen as a warning to Chinese AI entrepreneurs that relocating IP and talent offshore will face increasing resistance from Beijing.",W,yes
a082,technology,www.cnn.com,https://www.cnn.com/2026/04/27/tech/elon-musk-sam-altman-openai-lawsuit,"Musk took the stand on the first day of his trial against OpenAI in Oakland, California, framing the case as a fight for the integrity of charitable institutions. He testified he co-founded and funded OpenAI as a nonprofit to serve the benefit of all humanity. He is seeking $130 billion in damages, reinstatement of the nonprofit structure, and the removal of Altman and Brockman from OpenAI's board.",W,yes
a083,technology,www.cnn.com,https://www.cnn.com/2026/04/24/tech/chinas-ai-deepseek-v4-intl-hnk,"DeepSeek released a preview of its V4 model on April 24, its most significant architectural update since the R1 model shook global AI markets in early 2025. V4 comes in two variants — V4-Pro and V4-Flash — and is open source, supporting up to 1 million tokens of context. DeepSeek claims V4 rivals top closed-source models from OpenAI, Anthropic, and Google on major benchmarks while maintaining cost efficiency.",W,yes
a084,technology,www.cnn.com,https://www.cnn.com/2026/04/24/tech/microsoft-voluntary-buyouts-us-employees,"Microsoft offered voluntary retirement packages to approximately 7% of its U.S. workforce — the first such program in the company's 51-year history. Eligible employees are those at the senior director level or below whose age and years of service combine to 70 or higher. The move follows the layoff of 9,000 employees last summer and reflects the broader industry trend of restructuring workforces to fund AI infrastructure buildouts.",W,yes
a085,technology,www.scworld.com,https://www.scworld.com/news/copy-fail-bug-can-obtain-root-privileges-in-linux-distributions-since-2017,"Security firm Theori discovered CVE-2026-31431, a critical logic flaw in the Linux kernel's cryptographic subsystem present in virtually all distributions since 2017. A 732-byte Python proof-of-concept script can exploit the bug to grant any unprivileged local user full root access, with no race condition required. Patches are available in kernel versions 6.18.22, 6.19.12, and 7.0.",W,yes
a086,technology,www.scworld.com,https://www.scworld.com/news/microsoft-qr-code-captcha-gated-phishing-more-than-double-in-q1-2026,"Microsoft's Q1 2026 threat intelligence report revealed approximately 8.3 billion email-based phishing threats between January and March, with QR code phishing surging 146% to 18.7 million attacks in March. CAPTCHA-gated phishing also spiked 125% to 11.9 million attacks, the highest monthly volume in over a year. The Tycoon2FA phishing-as-a-service platform remained a dominant enabler.",W,yes
a087,technology,www.scworld.com,https://www.scworld.com/news/cisa-adds-connectwise-microsoft-flaws-to-kev-catalog,"CISA added two actively exploited vulnerabilities to its Known Exploited Vulnerabilities catalog: a high-severity path traversal flaw in ConnectWise ScreenConnect and a medium-severity Windows Shell protection mechanism failure linked to an incomplete patch of a zero-day previously exploited by Russian threat group APT28. Federal agencies are required to remediate both by May 12, 2026.",W,yes
a088,technology,www.scworld.com,https://www.scworld.com/news/litellm-exploited-within-36-hours-of-disclosure-via-sql-injection-bug,"A critical pre-authentication SQL injection vulnerability in BerriAI's LiteLLM Python package was actively exploited just 36 hours after its public disclosure. Attackers demonstrated prior knowledge of LiteLLM's internal database structure, directly targeting tables holding API keys and provider credentials for services like OpenAI, Anthropic, and AWS Bedrock. Users are urged to upgrade to version 1.83.7-stable immediately.",W,yes
a089,technology,www.scworld.com,https://www.scworld.com/resource/handling-shadow-ai-at-the-source-why-the-browser-is-the-new-control-layer,"With 78% of employees using AI tools not approved by their organizations, security teams face a growing shadow AI problem that traditional controls cannot address. The article argues that the enterprise web browser is the most effective control layer available. A secure enterprise browser can monitor AI usage, enforce identity-based data policies, and prevent sensitive information from leaking to unauthorized AI services.",W,yes
a090,technology,www.scworld.com,https://www.scworld.com/news/firefox-report-offers-early-insight-into-claude-mythos-ai-model,"Mozilla's Firefox security team tested an early version of Anthropic's Claude Mythos and the evaluation led to fixes for 271 vulnerabilities in the Firefox 150 release. Firefox CTO Bobby Holley stated that none of the bugs found were beyond the capability of an elite human researcher, suggesting Mythos primarily democratizes and accelerates elite-level security analysis. Security experts warn this same democratization could also lower the barrier for offensive actors.",W,yes
a091,sports,www.cnbc.com,https://www.cnbc.com/2026/04/30/pricey-nfl-nba-ownership-stakes-investors-leagues-valuations.html,"As average NFL team valuations reach $7.65 billion and NBA teams average $5.52 billion, many investors are priced out of minority stake deals in the major leagues. This is driving bidding wars and soaring valuations in smaller leagues like the NWSL and WNBA, where check sizes are more accessible. Sports bankers note there is far more liquidity at lower price points, with investors substituting into alternative leagues as the big four become increasingly out of reach.",W,yes
a092,sports,www.cnbc.com,https://www.cnbc.com/2026/04/29/saudi-pif-to-end-funding-liv-golf.html,"Saudi Arabia's Public Investment Fund, which has invested more than $5 billion in LIV Golf since its 2022 launch, will withdraw its financial backing at the end of the 2026 season. PIF chairman Yasir Al-Rumayyan stepped down from his LIV board role, and the league has established a new independent board to seek alternative investors. Despite the news, LIV says it is on pace to generate $100 million more in revenue year-over-year in 2026.",W,yes
a093,sports,www.cnbc.com,https://www.cnbc.com/2026/04/23/nfl-draft-nil-changes-significance-of-contracts-for-prospects.html,"The rise of NIL deals has fundamentally altered the meaning of the NFL Draft for young players. Presumptive first overall pick Fernando Mendoza has already earned an estimated $1 million-plus through NIL before signing a single professional contract. NIL is also keeping talented players in college longer, with 49ers GM John Lynch observing that the NFL is now competing with college football as a financial destination for athletes.",W,yes
a094,sports,www.cnbc.com,https://www.cnbc.com/2026/04/15/fifa-president-iran-team-coming-for-sure-to-2026-world-cup-in-us.html,"Despite the ongoing U.S.-Iran war raising questions about Iran's participation in the 2026 FIFA World Cup, FIFA President Gianni Infantino told CNBC that Iran will compete, including games scheduled on U.S. soil. Infantino visited the Iranian team at their training camp in Turkey and emphasized that sports should be outside of politics. Iran had requested to move its games to Mexico, but that request was denied by FIFA.",W,yes
a095,sports,www.cnbc.com,https://www.cnbc.com/2026/04/09/doj-investigating-nfl-media-rights-antitrust.html,"The U.S. Department of Justice has opened an antitrust investigation into the NFL over its media distribution strategy, focusing on questions of consumer affordability and fair competition among broadcasters. The probe comes as the NFL considers expanding its streaming arrangements under its current 11-year, $111 billion media deal. Critics argue that spreading games across multiple paid streaming platforms undermines the league's antitrust exemption under the 1961 Sports Broadcasting Act.",W,yes
a096,sports,www.cnbc.com,https://www.cnbc.com/2026/04/09/amazon-masters-coverage-media-partner-streaming.html,"Amazon Prime Video made its debut as a Masters media partner, with exclusive live coverage of two hours per day during Rounds 1 and 2 of the tournament. Amazon becomes only the fourth-ever media partner for Augusta National, following CBS, USA Network, and ESPN. The article notes the strategic value for Amazon lies primarily in the halo effect the Masters brand provides across its sports portfolio.",W,yes
a097,sports,www.cnbc.com,https://www.cnbc.com/2026/04/09/olympic-skier-lindsey-vonn-2030-games.html,"Lindsey Vonn, recovering from a devastating crash during the 2026 Milan-Cortina Olympics that nearly cost her her leg, said she has not ruled out competing in the 2030 Winter Games at age 45. Vonn said she would only attempt a comeback if she could be fast, and acknowledged it would be rare but not unprecedented. The article details her grueling rehabilitation process and broader strategy of building a personal brand beyond skiing.",W,yes
a098,sports,www.cnbc.com,https://www.cnbc.com/2026/04/04/pwhl-womens-hockey-growth.html,"The Professional Women's Hockey League is riding a wave of momentum following the 2026 Milan Winter Olympics, where the U.S.-Canada gold medal game set viewership records. The eight-team league surpassed one million season attendees for the first time, with average attendance up 28% year-over-year and merchandise sales up 50%. A new broadcast deal with Scripps Sports will air the Walter Cup Finals on Ion.",W,yes
a099,sports,www.cnbc.com,https://www.cnbc.com/2026/04/02/regional-sports-networks-are-faltering-even-as-ratings-soar.html,"Live sports continue to command record TV ratings, yet regional sports networks are collapsing financially. The wind-down of Main Street Sports led MLB to take over media distribution for 14 teams as the 2026 season began. The structural cause is cord-cutting — as pay TV subscribers switch to streaming, the RSN cable bundle model loses its economic foundation, leaving teams scrambling for new distribution arrangements.",W,yes
a100,sports,www.cnbc.com,https://www.cnbc.com/2026/03/11/cheltenham-festival-horse-racing-in-crisis-charles-allen-resigns.html,"Lord Charles Allen resigned as chair of the British Horseracing Authority after just six months, unable to achieve the governance reforms he sought. The Jockey Club responded by demanding a review of the Racecourse Association, triggering what the article describes as a civil war among course owners. Racecourse attendance remains below pre-pandemic levels and betting revenue is declining.",W,yes
a101,sports,www.foxnews.com,https://www.foxnews.com/outkick-sports/stephen-smith-blames-pga-tour-liv-golf-saga-moronically-says-defectors-shouldnt-face-punishment,"Following the announcement that Saudi Arabia's PIF will stop funding LIV Golf after 2026, ESPN's Stephen A. Smith argued that the PGA Tour's negligence was the root cause of the LIV exodus, and that returning defectors should face zero punishment. OutKick pushed back, calling the take moronic given that players made a deliberate choice for financial gain and the Tour has no obligation to welcome them back unconditionally.",W,yes
a102,sports,www.foxnews.com,https://www.foxnews.com/sports/former-mlb-slugger-says-teams-want-trevor-bauer-pitcher-must-something-first,"Albert Pujols told Fox News Digital that while any team should want former Cy Young Award winner Trevor Bauer given his talent, Bauer first needs to resolve his standing dispute with MLB before being considered. Bauer has been out of the majors since 2021 following sexual assault allegations, has maintained his innocence, and has reportedly offered to play for free — but no MLB team has signed him.",W,yes
a103,sports,www.foxnews.com,https://www.foxnews.com/outkick-sports/ravens-signing-40-year-old-defensive-lineman-play-19th-nfl-season-awesome,"The Baltimore Ravens signed 40-year-old defensive lineman Calais Campbell to a one-year deal, making him the oldest defensive lineman currently in the NFL entering his 19th season. The article highlights Campbell's remarkable longevity given the brutal physical demands of defensive line play, where most careers end a decade earlier.",W,yes
a104,sports,www.foxnews.com,https://www.foxnews.com/sports/fevers-sophie-cunningham-priceless-reaction-blake-shelton-showing-practice,Indiana Fever player Sophie Cunningham's viral reaction to country star Blake Shelton appearing at team practice captured widespread attention on social media. The moment humanized the WNBA players and illustrated the growing cultural crossover between professional women's basketball and entertainment.,W,yes
a105,sports,www.foxnews.com,https://www.foxnews.com/sports/drake-maye-voices-support-patriots-coach-mike-vrabel-field-controversy-continues-swirl,New England Patriots quarterback Drake Maye publicly backed head coach Mike Vrabel amid a controversy over the playing surface at Gillette Stadium. Maye's show of support was significant given his role as the team's franchise quarterback and the face of the Vrabel era in New England.,W,yes
a106,sports,www.foxnews.com,https://www.foxnews.com/sports/zaragoza-goalkeeper-andrada-handed-12match-suspension-for-throwing-punch-in-2ndtier-game-in-spain,Real Zaragoza goalkeeper Andrada received a 12-match ban from Spanish football authorities after throwing a punch at an opponent during a second-division match. The incident sparked discussion about player conduct and the severity of disciplinary measures in Spain's lower professional leagues.,W,yes
a107,sports,www.foxnews.com,https://www.foxnews.com/sports/fifa-in-talks-about-requiring-soccer-clubs-to-field-at-least-one-homegrown-young-player-in-games,FIFA is exploring a rule that would require professional clubs to include at least one locally developed young player in their matchday squads. The initiative is part of broader efforts to protect youth development pathways and counter concerns that wealthy clubs are crowding out homegrown talent through expensive international transfers.,W,yes
a108,sports,www.foxnews.com,https://www.foxnews.com/sports/fox-sports-2026-fifa-world-cup-match-commentators-reporters-john-strong-stu-holden-ian-darke-landon-donovan-maurice-edu-cobi-jones,"Fox Sports unveiled its broadcast team for the 2026 FIFA World Cup, including commentators John Strong and Ian Darke, and analysts Stu Holden, Landon Donovan, Maurice Edu, and Cobi Jones. The team reflects Fox's continued investment in making the U.S.-hosted tournament a major television event, with the broadcaster holding rights to the majority of World Cup matches.",W,yes
a109,sports,www.foxnews.com,https://www.foxnews.com/sports/zinedine-zidanes-son-luca-suffers-fractured-jaw-to-leave-algeria-sweating-on-his-world-cup-availability,"Luca Zidane, son of legendary player Zinedine Zidane and goalkeeper for the Algerian national team, suffered a fractured jaw that cast doubt over his availability for the 2026 World Cup. The injury added to an already complicated pre-tournament period for Algeria, whose preparations were disrupted by player availability issues.",W,yes
