id,category,source,url,reference_summary,who,done
a110,sports,www.foxnews.com,https://www.foxnews.com/sports/cardinals-top-pick-jeremiyah-love-explains-plans-never-touch-53m-nfl-salary,Arizona Cardinals first-round pick Jeremiyah Love discussed a disciplined financial philosophy — planning to live entirely off endorsement and NIL income rather than touching his $53 million rookie NFL contract. The article framed this as representative of how NIL has shifted the financial thinking of elite college athletes entering the draft.,W,yes
a111,sports,www.foxnews.com,https://www.foxnews.com/outkick-sports/peta-happy-indycar-driver-romain-grosjean-bird-strike-testing,"PETA expressed satisfaction that IndyCar driver Romain Grosjean experienced a bird strike during testing, framing it as nature fighting back. OutKick mocked the animal rights organization's stance as absurd given that the bird did not survive the incident.",W,yes
a112,sports,www.foxnews.com,https://www.foxnews.com/outkick-sports/georgia-kirby-smart-says-big-ten-competitive-conference-sec-cfp-title-streak,Georgia head coach Kirby Smart acknowledged the Big Ten's growing competitiveness in college football while defending the SEC's track record in the College Football Playoff. The article reflects ongoing debate about conference parity heading into a new CFP format that has expanded access for non-SEC programs.,W,yes
a113,sports,www.foxnews.com,https://www.foxnews.com/sports/indycar-all-in-docuseries-mclaren-pato-oward-lundgaard-siegel,"IndyCar announced an All In docuseries that will follow McLaren's racing team, including drivers Pato O'Ward and Christian Lundgaard. The behind-the-scenes series aims to grow IndyCar's fanbase by offering a Netflix-style access-all-areas look at the sport, following the success of similar formats in Formula 1 and other racing series.",W,yes
a114,sports,abcnews.com,https://abcnews.com/Sports/wireStory/brown-celtics-aim-clinch-series-philadelphia-132524240,"The Boston Celtics, led by Jaylen Brown averaging 28.7 points per game, aim to close out their NBA playoff first-round series against the Philadelphia 76ers in Game 6. The 76ers' Joel Embiid returned from an appendectomy to score 33 points in a Game 5 win, keeping Philadelphia's season alive. The Celtics enter as the second seed in the East looking to advance.",W,yes
a115,sports,abcnews.com,https://abcnews.com/Sports/wireStory/worlds-tallest-basketball-player-7-foot-9-olivier-132536061,"Olivier, recognized as the world's tallest basketball player at 7-foot-9, has generated widespread attention in the basketball world. The article explores the physical challenges and unique opportunities that come with being a player of such exceptional stature, and the interest from teams and scouts in his potential as a professional prospect.",W,yes
a116,sports,abcnews.com,https://abcnews.com/Sports/wireStory/jalen-brunson-scores-39-points-knicks-rout-hawks-132482096,Jalen Brunson scored 39 points to power the New York Knicks to a dominant playoff win over the Atlanta Hawks. The result gave the Knicks a commanding position in their first-round series and underscored Brunson's emergence as one of the NBA's premier postseason performers.,W,yes
a117,sports,abcnews.com,https://abcnews.com/Sports/wireStory/austin-reaves-returns-lakers-lineup-game-5-after-132519458,Austin Reaves returned to the Los Angeles Lakers' playoff rotation for Game 5 of their first-round series after missing nine games with an oblique injury. His return was considered a significant boost for a Lakers team navigating the early rounds of the postseason with a depleted roster.,W,yes
a118,sports,abcnews.com,https://abcnews.com/Sports/wireStory/wembanyamas-double-double-powers-spurs-past-trail-blazers-132483866,Victor Wembanyama delivered a double-double performance to lead the San Antonio Spurs past the Portland Trail Blazers in the NBA postseason. The result further cemented Wembanyama's status as one of the game's most impactful young players in high-stakes situations.,W,yes
a119,sports,abcnews.com,https://abcnews.com/Sports/wireStory/golden-knights-aim-clinch-series-win-mammoth-132524861,The Vegas Golden Knights are positioned to clinch their playoff series against the Colorado Mammoth and advance to the next round of the postseason. The game preview highlights the Golden Knights' opportunity to close out the series on home ice.,W,yes
a120,sports,abcnews.com,https://abcnews.com/Sports/wireStory/cade-cunningham-pistons-brink-outduels-magic-star-paolo-132521831,"Detroit Pistons star Cade Cunningham delivered a clutch performance in a must-win Game 5 against the Orlando Magic, outplaying Paolo Banchero to keep the Pistons' playoff hopes alive. The result extended a tightly contested first-round series and highlighted the emerging rivalry between the two young franchise cornerstones.",W,yes
